{
  "claims": [
    {
      "claim_id": "clm_contract",
      "text": "Full-time employees receive 15 days of paid vacation per year.",
      "canonical_form": "full-time employees receive 15 days of paid vacation per year",
      "type": "doc_grounded",
      "risk_level": "medium",
      "requires_evidence": true,
      "source_span": null,
      "metadata": {}
    }
  ],
  "documents": [
    {
      "source_ref": "hr-manual-v7",
      "content": "Full-time employees receive 15 days of paid vacation per year.",
      "authority": "internal",
      "metadata": { "department": "hr" }
    }
  ],
  "context_refs": [],
  "metadata_filter": { "department": "hr" },
  "max_evidence_per_claim": 3
}
